{
  "schemaVersion": 1,
  "kind": "binary-re-pe-elf-inventory",
  "adapterId": "static-binary-triage-sidecar",
  "source": {
    "path": "inputs/synthetic-elf.bin",
    "sha256": "d910586d9232ec8247a0ed3b6821b89171b9c91749174c46c0b981dc765fa3c3",
    "bytes": 448
  },
  "format": {
    "family": "elf",
    "class": "elf64",
    "bitness": 64,
    "endianness": "little",
    "machine": "em_x86_64",
    "fileType": "et_exec",
    "entryPoint": "0x0"
  },
  "sections": [
    {
      "name": "\u003csection-0\u003e",
      "type": "sht_null",
      "virtualAddress": "0x0",
      "virtualSize": "0x0",
      "fileOffset": 0,
      "fileSize": 0,
      "permissions": "r--"
    },
    {
      "name": ".shstrtab",
      "type": "sht_strtab",
      "virtualAddress": "0x0",
      "virtualSize": "0x11",
      "fileOffset": 128,
      "fileSize": 17,
      "permissions": "r--"
    },
    {
      "name": ".text",
      "type": "sht_progbits",
      "virtualAddress": "0x401000",
      "virtualSize": "0x1",
      "fileOffset": 160,
      "fileSize": 1,
      "permissions": "r-x"
    }
  ],
  "imports": [],
  "exports": [],
  "warnings": [],
  "boundaries": {
    "readOnlyInput": true,
    "noSampleExecution": true,
    "noNetwork": true,
    "noCatalogEntryExecution": true,
    "noAuthorityOrConfirmed": true
  }
}
