{
  "schemaVersion": 1,
  "kind": "binary-re-pe-elf-inventory",
  "adapterId": "static-binary-triage-sidecar",
  "source": {
    "path": "inputs/synthetic-pe.bin",
    "sha256": "28d9eda03260d92fcd5616571165a9e1b9196e8b739e11b43026c3071d373e34",
    "bytes": 544
  },
  "format": {
    "family": "pe",
    "class": "pe32+",
    "bitness": 64,
    "endianness": "little",
    "machine": "amd64",
    "fileType": "executable",
    "entryPoint": "0x0",
    "imageBase": "0x140000000"
  },
  "sections": [
    {
      "name": ".text",
      "type": "code",
      "virtualAddress": "0x1000",
      "virtualSize": "0x1",
      "fileOffset": 512,
      "fileSize": 32,
      "permissions": "r-x"
    }
  ],
  "imports": [],
  "exports": [],
  "warnings": [],
  "boundaries": {
    "readOnlyInput": true,
    "noSampleExecution": true,
    "noNetwork": true,
    "noCatalogEntryExecution": true,
    "noAuthorityOrConfirmed": true
  }
}
